{
  "$schema": "https://json-schema.org/draft/2020-12/schema",
  "$id": "openmathmodel.contracts.v1.agent-event",
  "title": "AgentEvent",
  "description": "供 Web/Desktop 实时呈现的统一事件信封。PostgreSQL 事件表是时间线事实来源；sequence 在 run 内单调递增且唯一，SSE 的事件 id 即 sequence。",
  "type": "object",
  "properties": {
    "id": { "type": "string", "pattern": "^evt_[0-9a-f]{32}$" },
    "run_id": { "type": "string", "pattern": "^run_[0-9a-f]{32}$" },
    "sequence": { "type": "integer", "minimum": 1 },
    "step_id": {
      "oneOf": [
        { "type": "null" },
        { "type": "string", "pattern": "^step_[0-9a-f]{32}$" }
      ]
    },
    "type": {
      "type": "string",
      "enum": [
        "run.created",
        "run.status_changed",
        "run.node_changed",
        "run.log",
        "step.started",
        "step.succeeded",
        "step.failed",
        "approval.requested",
        "approval.resolved",
        "artifact.published"
      ]
    },
    "payload": {
      "type": "object",
      "description": "按 type 解释的载荷。消费方必须容忍未知字段。"
    },
    "created_at": { "$ref": "#/$defs/timestamp" }
  },
  "required": ["id", "run_id", "sequence", "type", "payload", "created_at"],
  "additionalProperties": false,
  "$defs": {
    "timestamp": {
      "type": "string",
      "pattern": "^\\d{4}-\\d{2}-\\d{2}T\\d{2}:\\d{2}:\\d{2}(\\.\\d{1,6})?Z$",
      "description": "UTC ISO-8601，统一以 Z 结尾。"
    }
  }
}
