{
  "id": "evt_aabbccddeeff00112233445566778899",
  "run_id": "run_1a2b3c4d5e6f708192a3b4c5d6e7f809",
  "sequence": 9,
  "step_id": "step_0123456789abcdef0123456789abcdef",
  "type": "approval.requested",
  "payload": {
    "approval_id": "appr_99887766554433221100ffeeddccbbaa",
    "decision_type": "confirm_plan",
    "title": "确认建模方案"
  },
  "created_at": "2026-08-04T08:06:00Z"
}
